{
  "$schema": "./glossary.schema.json",
  "title": "Catalog Glossary",
  "description": "Plain-English definitions for terms and acronyms that appear across the catalog. Each entry has a one-line gloss in everyday language and an optional longer note. Pattern pages link these terms inline so a reader new to agent vocabulary does not have to leave the page.",
  "last_analysis_date": "2026-04-30",
  "terms": [
    {
      "id": "llm",
      "term": "LLM",
      "expansion": "Large Language Model",
      "gloss": "A model that takes text in and produces text out, trained on a lot of text. ChatGPT, Claude, and Gemini are LLMs."
    },
    {
      "id": "rag",
      "term": "RAG",
      "expansion": "Retrieval-Augmented Generation",
      "gloss": "Before answering a question, the system fetches relevant documents from a search index and includes them in the prompt, so the model has source material to read instead of guessing from memory."
    },
    {
      "id": "mcp",
      "term": "MCP",
      "expansion": "Model Context Protocol",
      "gloss": "A shared protocol so any tool written for one agent host (Claude Desktop, Cursor, your own CLI) can be used by any other host without rewriting the integration."
    },
    {
      "id": "bm25",
      "term": "BM25",
      "gloss": "An old, fast keyword-matching scoring algorithm used by search engines. Good at exact-token matches like product codes and proper nouns; poor at semantic similarity."
    },
    {
      "id": "embedding",
      "term": "Embedding",
      "gloss": "A list of numbers that represents the meaning of a piece of text. Two pieces of text with similar meanings have similar embeddings, so 'nearest-neighbour' search finds semantically related content."
    },
    {
      "id": "dag",
      "term": "DAG",
      "expansion": "Directed Acyclic Graph",
      "gloss": "A graph of steps where each step points forward to its dependents and never loops back. Useful for parallelising independent steps in a plan."
    },
    {
      "id": "json-schema",
      "term": "JSON Schema",
      "gloss": "A standard way of describing the shape of a JSON object — what fields it must have, what types they are. Lets a validator reject calls that don't match before they reach the executor."
    },
    {
      "id": "tool-palette",
      "term": "Tool palette",
      "gloss": "The set of typed function-like tools an agent is allowed to call. The agent picks one per turn; the host validates the call against the palette's schema."
    },
    {
      "id": "tool-plane",
      "term": "Tool plane",
      "gloss": "The infrastructure layer that hosts and executes tools — separate from the model itself. Tools live in the tool plane; the model only emits calls into it."
    },
    {
      "id": "step-budget",
      "term": "Step budget",
      "gloss": "A hard cap on how many loop iterations or tool calls an agent may make before it must stop. Prevents runaway behaviour."
    },
    {
      "id": "episode",
      "term": "Episode",
      "gloss": "One unit of agent work, usually 'from a user message to the next user message' (including all tool calls in between). Memory and reasoning traces are often scoped to a single episode."
    },
    {
      "id": "compaction",
      "term": "Compaction",
      "gloss": "Replacing older parts of the conversation history with shorter summaries to free up context-window space while keeping the gist."
    },
    {
      "id": "reranking",
      "term": "Reranking",
      "gloss": "After an initial fast retriever returns ~100 candidates, a slower, more accurate model scores each one against the query and reorders them. Trades inference cost for sharper top-k."
    },
    {
      "id": "few-shot",
      "term": "Few-shot",
      "gloss": "Showing the model a handful of input/output examples in the prompt to teach it the format or task, instead of fine-tuning."
    },
    {
      "id": "zero-shot",
      "term": "Zero-shot",
      "gloss": "Asking the model to do a task with no examples, just an instruction. The opposite of few-shot."
    },
    {
      "id": "cot",
      "term": "CoT",
      "expansion": "Chain of Thought",
      "gloss": "Asking the model to write out intermediate reasoning steps before giving the final answer. Improves accuracy on multi-step problems but costs more tokens."
    },
    {
      "id": "moe",
      "term": "MoE",
      "expansion": "Mixture of Experts",
      "gloss": "A routing layer that sends each request to the specialist sub-model best suited for it, instead of running every request through one giant model."
    },
    {
      "id": "hitl",
      "term": "HITL",
      "expansion": "Human-in-the-loop",
      "gloss": "A point in the workflow where a human reviews or approves an agent's action before it executes."
    },
    {
      "id": "kv-cache",
      "term": "KV cache",
      "expansion": "Key-Value cache",
      "gloss": "An internal cache the LLM keeps for tokens it has already processed in a long context, so subsequent generation is faster. Prompt caching exposes this externally."
    },
    {
      "id": "prompt-cache",
      "term": "Prompt cache",
      "gloss": "A vendor-side cache (Anthropic, OpenAI, Google all offer this) that lets you re-send the same long prompt prefix cheaply. Useful when the system prompt is huge but stable across calls."
    },
    {
      "id": "sandbox",
      "term": "Sandbox",
      "gloss": "A restricted environment where untrusted code or tool calls run with limited capabilities (no network, no host filesystem) so they cannot damage the host system."
    },
    {
      "id": "subagent",
      "term": "Subagent",
      "gloss": "A child agent invoked by a parent agent to handle a bounded sub-task. Has its own context, tools, and step budget; returns a single structured result to the parent."
    },
    {
      "id": "trajectory",
      "term": "Trajectory",
      "gloss": "The full sequence of an agent's thoughts, tool calls, observations, and intermediate state on one task — what the agent did, not just what it said in the end."
    },
    {
      "id": "constitutional-ai",
      "term": "Constitutional AI",
      "gloss": "Anthropic's approach to alignment where the model is trained to follow an explicit list of principles ('the constitution') and to critique and revise its own outputs against them."
    },
    {
      "id": "provenance",
      "term": "Provenance",
      "gloss": "An auditable record of where an output came from: which tool calls produced it, which documents were retrieved, which model version was running."
    },
    {
      "id": "saga",
      "term": "Saga",
      "gloss": "A distributed-systems pattern where each step in a multi-step workflow is paired with a compensating action that can undo it if a later step fails."
    },
    {
      "id": "circuit-breaker",
      "term": "Circuit breaker",
      "gloss": "A protection layer that stops calling a failing dependency after error rates exceed a threshold, then trial-calls again after a cooldown. Prevents retry storms and wasted cost."
    },
    {
      "id": "quorum",
      "term": "Quorum",
      "gloss": "A minimum number of independent agents (or replicas) that must agree before an action can proceed. Stops a single misbehaving agent from causing damage."
    },
    {
      "id": "soft-404",
      "term": "Soft 404",
      "gloss": "A web page that returns HTTP 200 (success) but actually shows a 'page not found' message. Looks alive to a HEAD probe; dead to a real reader."
    },
    {
      "id": "context-window",
      "term": "Context window",
      "gloss": "The maximum number of tokens (roughly: words plus punctuation) a model can read in one call. Anything beyond it gets truncated or paged."
    },
    {
      "id": "fine-tuning",
      "term": "Fine-tuning",
      "gloss": "Continuing to train a base model on a smaller, more specific dataset so it specialises in a domain or task."
    },
    {
      "id": "rlhf",
      "term": "RLHF",
      "expansion": "Reinforcement Learning from Human Feedback",
      "gloss": "A training technique where humans rank pairs of model outputs and the model learns to prefer the preferred one. The dominant alignment recipe for chat models."
    },
    {
      "id": "wasm",
      "term": "Wasm",
      "expansion": "WebAssembly",
      "gloss": "A portable binary format that runs sandboxed at near-native speed in many languages. Useful for executing third-party agent skills without trusting them with host privileges."
    },
    {
      "id": "mcts",
      "term": "MCTS",
      "expansion": "Monte Carlo Tree Search",
      "gloss": "A search algorithm that grows a tree of possible futures by random rollouts, using the rollout outcomes to bias which branches to expand next. Used in game-playing agents (AlphaGo) and, in this catalog, as the spine of LATS-style agent search."
    },
    {
      "id": "uct",
      "term": "UCT",
      "expansion": "Upper Confidence bound applied to Trees",
      "gloss": "The selection rule MCTS uses to pick which child node to expand next: balance high-mean nodes (exploit) against rarely-visited nodes (explore) using a confidence-bound formula."
    },
    {
      "id": "ucb",
      "term": "UCB",
      "expansion": "Upper Confidence Bound",
      "gloss": "A bandit-algorithm rule that picks the arm with the highest 'mean reward plus uncertainty bonus.' UCT is UCB applied inside a tree."
    },
    {
      "id": "rl",
      "term": "RL",
      "expansion": "Reinforcement Learning",
      "gloss": "A training paradigm where an agent learns by taking actions, receiving rewards, and updating its policy to seek more reward. Expensive at LLM scale; Reflexion-style verbal lessons are a cheap alternative."
    },
    {
      "id": "sse",
      "term": "SSE",
      "expansion": "Server-Sent Events",